<?xml version="1.0" encoding="ISO-8859-1"?>
<!DOCTYPE gramatica SYSTEM "automato.dtd">
<gramatica>
    <estado>
		<id>0</id>
		<final>false</final>
        <tipo>0</tipo>
		<transicao>
			<entradas>ISK()</entradas>
			<proximo>1</proximo>
		</transicao>
    </estado><estado>
		<id>1</id>
		<final>true</final>
        <tipo>1</tipo>
	</estado>
</gramatica>